{"schema":"run-receipt.v1","receiptId":"01J9ZZZZZZZZZZZZZZZZZZZZZ7","packageId":"01J9ZZZZZZZZZZZZZZZZZZZZZ1","runId":"01J9ZZZZZZZZZZZZZZZZZZZZZ8","issuer":{"kind":"123","id":"api.123.do"},"correlation":{"refs":[{"kind":"action","id":"42"},{"kind":"step","id":"17"}]},"packageDigest":"sha256:2937ba90fc172fb24c062a3eddb5911a2eae96514ec2338d6124707c43faffe2","conditionsDigest":"sha256:fb00eceeef5dfcb86442552266d1eb26920c245b26ee1a92d659bc44c76e1ddc","agent":{"id":"example.test/helper","version":"1.2.0","digest":"sha256:f0c320a539ac10d7fd236f60f1d34ee8b0f6ee9aabdc865c8a2610fb6a3c6980"},"harness":{"adapter":"fake","version":"built-in"},"attempts":[{"n":1,"adapter":"fake","startedAt":"2026-09-05T10:00:00Z","endedAt":"2026-09-05T10:00:03Z","endReason":"completed","cost":{"usd":0,"turns":2,"tokens":0}}],"directives":{"received":["d-1"],"applied":["d-1"],"rejected":[]},"instructionHistory":{"uri":"file:///tmp/h.ndjson","digest":"sha256:0000000000000000000000000000000000000000000000000000000000000000"},"events":{"emitted":6,"coalesced":0},"startedAt":"2026-09-05T10:00:00Z","endedAt":"2026-09-05T10:00:03Z","status":"completed","summary":"done","conditions":[{"met":true,"proof":"test passes"},{"met":true,"proof":"go test ok"}],"evidence":{"filesChanged":["calc.go","calc_test.go"]},"cost":{"usd":0,"turns":2,"tokens":0},"receiptDigest":"sha256:ff824853708b1aaeb86da97b458ac771ddef98139fbb321b9eed5870ab8a01d6"}
